{
  "id": "nist-breathesmart", "name": "NIST BreatheSmart CSI", "year": 2023,
  "summary": "Government open data containing raw real and imaginary WiFi CSI for controlled respiratory-motion experiments with a breathing manikin.",
  "tasks": ["vital_sign"], "modalities": ["WiFi CSI"],
  "hardware": {"platform": "MIMO-OFDM WiFi test system", "chipset": null, "wifi_standard": null, "band": null},
  "settings": {"environments": 1, "subjects": 0, "scenario": "Anatomically correct breathing manikin under controlled respiratory motion"},
  "scale": {"human_subjects": 0, "data_organization": "Files corresponding to publication figures"},
  "original": {"landing_page": "https://doi.org/10.18434/mds2-2963", "download_page": "https://data.nist.gov/od/ds/ark:/88434/mds2-2963/BreatheSmartv2.zip", "access": "direct", "license": "NIST open license", "redistribution": "allowed", "formats": ["CSV", "ZIP", "DOCX documentation"]},
  "standardization": {"status": "verified", "profile": "vital-native-plus-20hz", "notes": "Verified on the official BreatheSmartv2.zip member Figure 11 a/BreathingPattern1.tar.gz. The adapter pairs real/imaginary CSI CSV logs, reshapes 9 links × 114 subcarriers, preserves config metadata, and can derive 20 Hz model views."},
  "sources": [{"type": "data", "url": "https://data.nist.gov/od/id/mds2-2963"}], "verified_at": "2026-07-07"
}
