{
  "id": "exposing-csi", "name": "Exposing the CSI", "year": 2023,
  "summary": "Large modern-WiFi experimental collection designed to study how bandwidth, MIMO, spectral resolution, hardware, and environment affect sensing.",
  "tasks": ["har", "occupancy"], "modalities": ["WiFi CSI", "video-derived ground truth"],
  "hardware": {"platform": "Modern commercial WiFi collectors", "chipset": null, "wifi_standard": "802.11ac/ax experimental configurations", "band": "Multiple bandwidths up to 160 MHz"},
  "settings": {"environments": 1, "subjects": null, "scenario": "Multiple controlled experiments varying WiFi configuration, collectors, target positions, and sensing conditions"},
  "scale": {"hours": 2, "size_gb": 80, "collectors": 3, "archives": "one per experiment"},
  "original": {"landing_page": "https://zenodo.org/records/7732595", "download_page": "https://zenodo.org/records/7732595", "access": "direct", "license": "Zenodo record terms; verify per archive", "redistribution": "unclear", "formats": ["Experiment archives", "CSI", "anonymized ground truth"]},
  "standardization": {"status": "adapter-ready", "profile": "continuous-native", "notes": "Treat bandwidth, MIMO mode, collector, position, and experiment as explicit domain fields rather than collapsing them."},
  "sources": [{"type": "paper", "url": "https://arxiv.org/abs/2302.00992"}, {"type": "data", "url": "https://zenodo.org/records/7732595"}], "verified_at": "2026-07-01"
}

