{
  "id": "wifi-80mhz", "name": "CSI Dataset for Wireless Human Sensing on 80 MHz Wi-Fi Channels", "year": 2023,
  "summary": "Modern 802.11ac CSI dataset designed for activity recognition, person identification, and people counting with hardware and environment diversity.",
  "tasks": ["har", "identity", "occupancy"], "modalities": ["WiFi CSI"],
  "hardware": {"platform": "Multiple commercial 802.11ac devices", "chipset": null, "wifi_standard": "802.11ac", "band": "5 GHz, 80 MHz"},
  "settings": {"environments": null, "subjects": 13, "scenario": "Multiple environments, days, hardware configurations, blocked direct path, and semi-anechoic chamber"},
  "scale": {"hours": 13, "size_gb": 23.6, "subsets": 26},
  "original": {"landing_page": "https://arxiv.org/abs/2305.03170", "download_page": "https://doi.org/10.21227/0p2j-zy98", "access": "account", "license": "IEEE DataPort terms", "redistribution": "restricted", "formats": ["Dataset-specific CSI files"]},
  "standardization": {"status": "adapter-ready", "profile": "continuous-100hz", "notes": "CFR preprocessing and four-monitor deinterleaving are implemented; real-release verification still requires DataPort access."},
  "sources": [{"type": "paper", "url": "https://arxiv.org/abs/2305.03170"}, {"type": "data", "url": "https://doi.org/10.21227/0p2j-zy98"}], "verified_at": "2026-06-28"
}
