{
  "id": "ntu-fi", "name": "NTU-Fi HAR and Human-ID", "year": 2022,
  "summary": "Paired Atheros-platform benchmarks for six-class human activity recognition and gait-based identification of fourteen people.",
  "tasks": ["har", "fall", "identity"], "modalities": ["WiFi CSI amplitude"],
  "hardware": {"platform": "Embedded WiFi sensing system", "chipset": "Atheros CSI Tool", "wifi_standard": "802.11n", "band": null},
  "settings": {"environments": null, "subjects": 14, "scenario": "Segmented activities and gait identity recordings"},
  "scale": {"har_samples": 1200, "human_id_samples": 840, "har_classes": 6, "identity_classes": 14, "shape": "3×114×500"},
  "original": {"landing_page": "https://github.com/xyanchen/WiFi-CSI-Sensing-Benchmark", "download_page": "https://github.com/xyanchen/WiFi-CSI-Sensing-Benchmark", "access": "account", "license": "Processed benchmark access via linked cloud storage; verify dataset terms", "redistribution": "restricted", "formats": ["Processed amplitude arrays"]},
  "standardization": {"status": "adapter-ready", "profile": "clip-500-packets", "notes": "Published benchmark representation is amplitude-only; do not imply that raw complex CSI is available."},
  "sources": [{"type": "repository", "url": "https://github.com/xyanchen/WiFi-CSI-Sensing-Benchmark"}], "verified_at": "2026-06-28"
}
