{
  "id": "wifi-tad", "name": "WiFiTAD", "year": 2025,
  "summary": "Continuous, untrimmed WiFi CSI recordings annotated with temporal boundaries for seven daily activities.",
  "tasks": ["tad_tal", "fall"], "modalities": ["WiFi CSI"],
  "hardware": {"platform": "Two laptops", "chipset": "Intel 5300", "wifi_standard": "802.11n", "band": null},
  "settings": {"environments": 1, "subjects": 3, "scenario": "7 m × 12 m office; continuous random activity sequences"},
  "scale": {"sequences": 553, "activity_instances": 2114, "activities": 7, "nominal_sample_rate_hz": 100, "approx_seconds_per_sequence": 85},
  "original": {"landing_page": "https://arxiv.org/abs/2412.16233", "download_page": null, "access": "unclear", "license": "Not stated for dataset", "redistribution": "unclear", "formats": []},
  "standardization": {"status": "adapter-ready", "profile": "continuous-100hz", "notes": "Official NPY orientation, amplitude normalization, and temporal annotation mapping are implemented; release access is tracked separately."},
  "sources": [{"type": "paper", "url": "https://arxiv.org/abs/2412.16233"}], "verified_at": "2026-06-28"
}
